{
  "schema": "ai-harness.lifecycle-close-receipt/v2",
  "sessionId": "har-003-20260909122155",
  "backlogTaskId": "HAR-003",
  "status": "done",
  "startedAt": "2026-09-09T12:21:55.661Z",
  "preparedAt": "2026-09-09T12:49:54.471Z",
  "closedAt": "2026-09-09T12:51:05.319Z",
  "summary": "Intake, slicing y promoción gobernada sobre el backlog canónico, con pruebas adversas de pérdida/mezcla y vistas general/por producto sin autoridad paralela.",
  "task": {
    "id": "HAR-003",
    "title": "Estructurar intake, trazabilidad y slicing",
    "scope": {
      "in": [
        "Schema de intake",
        "Clasificación de hechos/supuestos/dudas",
        "Slicing independiente orientado a resultados terminables",
        "Trazabilidad al backlog canónico general y por producto",
        "Reglas de estado y promoción gobernada"
      ],
      "out": [
        "Inferir respuestas humanas",
        "Crear un backlog paralelo",
        "Gestor de proyectos externo",
        "Comenzar automáticamente el trabajo promovido"
      ]
    },
    "acceptanceCriteria": [
      "Un intake conserva todo requisito material del pedido.",
      "Cada slice tiene un resultado, alcance, producto dueño y gate verificables que favorecen completar trabajo antes de abrir más frentes.",
      "El backlog canónico permite reconstruir la vista general y por producto sin duplicar autoridad.",
      "Una promoción solo se propone cuando todas las dependencias están done y no quedan decisiones pendientes; el control no muta la autoridad.",
      "Cambios de alcance quedan como decisión o supersesión.",
      "Existen pruebas adversas de pérdida y mezcla de requisitos."
    ],
    "verification": [
      "Fixtures de prompts extensos y diffs semánticos requisito→tarea."
    ],
    "decisionRefs": [
      "DEC-002",
      "DEC-007",
      "DEC-008",
      "DEC-010"
    ]
  },
  "git": {
    "branch": "feature/ai-conversational-platform-standalone",
    "baseCommit": "389d93911a0749f3d06dea476c2f52470ecb7096",
    "headAtClose": "389d93911a0749f3d06dea476c2f52470ecb7096",
    "worktree": "/Users/rodrigo/Git/personal/react_admin_dashboard",
    "linkedWorktree": false,
    "preexistingChanges": [],
    "diff": {
      "schema": "ai-harness.git-diff-receipt/v1",
      "baseCommit": "389d93911a0749f3d06dea476c2f52470ecb7096",
      "head": "389d93911a0749f3d06dea476c2f52470ecb7096",
      "branch": "feature/ai-conversational-platform-standalone",
      "worktree": "/Users/rodrigo/Git/personal/react_admin_dashboard",
      "linkedWorktree": false,
      "changedPaths": [
        "ai-harness-local/README.md",
        "ai-harness-local/control/capabilities.json",
        "ai-harness-local/feature_list.json",
        "ai-harness-local/progress/current.json",
        "ai-harness-local/progress/current.md",
        "ai-harness/AGENTS.md",
        "ai-harness/CHANGELOG.md",
        "ai-harness/README.md",
        "ai-harness/VERSION",
        "ai-harness/config/project.json",
        "ai-harness/docs/backlog-contract.md",
        "ai-harness/docs/intake.md",
        "ai-harness/docs/workflow.md",
        "ai-harness/harness/backlog-governance.mjs",
        "ai-harness/harness/control.mjs",
        "ai-harness/harness/intake.mjs",
        "ai-harness/harness/lifecycle.mjs",
        "ai-harness/harness/tests/control.test.mjs",
        "ai-harness/harness/tests/fixtures/intake/long-commerce-metrics-request.md",
        "ai-harness/harness/tests/intake.test.mjs",
        "ai-harness/harness/tests/lifecycle.test.mjs",
        "ai-harness/releases/0.6.0.md",
        "ai-harness/schemas/intake.schema.json",
        "docs/CANONICAL_INDEX.md",
        "docs/EXECUTION_BACKLOG_2026-09-08.md",
        "docs/audit/HARNESS_CAPABILITY_GAP_2026-09-08.md",
        "package.json",
        "planning/backlog.json",
        "planning/fragments/platform.json"
      ],
      "ownedPaths": [
        "ai-harness-local/README.md",
        "ai-harness-local/control/capabilities.json",
        "ai-harness-local/feature_list.json",
        "ai-harness-local/progress/current.json",
        "ai-harness-local/progress/current.md",
        "ai-harness/AGENTS.md",
        "ai-harness/CHANGELOG.md",
        "ai-harness/README.md",
        "ai-harness/VERSION",
        "ai-harness/config/project.json",
        "ai-harness/docs/backlog-contract.md",
        "ai-harness/docs/intake.md",
        "ai-harness/docs/workflow.md",
        "ai-harness/harness/backlog-governance.mjs",
        "ai-harness/harness/control.mjs",
        "ai-harness/harness/intake.mjs",
        "ai-harness/harness/lifecycle.mjs",
        "ai-harness/harness/tests/control.test.mjs",
        "ai-harness/harness/tests/fixtures/intake/long-commerce-metrics-request.md",
        "ai-harness/harness/tests/intake.test.mjs",
        "ai-harness/harness/tests/lifecycle.test.mjs",
        "ai-harness/releases/0.6.0.md",
        "ai-harness/schemas/intake.schema.json",
        "docs/CANONICAL_INDEX.md",
        "docs/EXECUTION_BACKLOG_2026-09-08.md",
        "docs/audit/HARNESS_CAPABILITY_GAP_2026-09-08.md",
        "package.json",
        "planning/backlog.json",
        "planning/fragments/platform.json"
      ],
      "preservedPreexistingPaths": [],
      "nameStatus": [
        {
          "status": "M",
          "path": "ai-harness-local/README.md"
        },
        {
          "status": "M",
          "path": "ai-harness-local/control/capabilities.json"
        },
        {
          "status": "M",
          "path": "ai-harness-local/feature_list.json"
        },
        {
          "status": "M",
          "path": "ai-harness-local/progress/current.json"
        },
        {
          "status": "M",
          "path": "ai-harness-local/progress/current.md"
        },
        {
          "status": "M",
          "path": "ai-harness/AGENTS.md"
        },
        {
          "status": "M",
          "path": "ai-harness/CHANGELOG.md"
        },
        {
          "status": "M",
          "path": "ai-harness/README.md"
        },
        {
          "status": "M",
          "path": "ai-harness/VERSION"
        },
        {
          "status": "M",
          "path": "ai-harness/config/project.json"
        },
        {
          "status": "M",
          "path": "ai-harness/docs/backlog-contract.md"
        },
        {
          "status": "M",
          "path": "ai-harness/docs/workflow.md"
        },
        {
          "status": "M",
          "path": "ai-harness/harness/control.mjs"
        },
        {
          "status": "M",
          "path": "ai-harness/harness/lifecycle.mjs"
        },
        {
          "status": "M",
          "path": "ai-harness/harness/tests/control.test.mjs"
        },
        {
          "status": "M",
          "path": "ai-harness/harness/tests/lifecycle.test.mjs"
        },
        {
          "status": "M",
          "path": "docs/CANONICAL_INDEX.md"
        },
        {
          "status": "M",
          "path": "docs/EXECUTION_BACKLOG_2026-09-08.md"
        },
        {
          "status": "M",
          "path": "docs/audit/HARNESS_CAPABILITY_GAP_2026-09-08.md"
        },
        {
          "status": "M",
          "path": "package.json"
        },
        {
          "status": "M",
          "path": "planning/backlog.json"
        },
        {
          "status": "M",
          "path": "planning/fragments/platform.json"
        }
      ],
      "workingTree": [
        {
          "status": " M",
          "path": "ai-harness-local/README.md"
        },
        {
          "status": " M",
          "path": "ai-harness-local/control/capabilities.json"
        },
        {
          "status": " M",
          "path": "ai-harness-local/feature_list.json"
        },
        {
          "status": " M",
          "path": "ai-harness-local/progress/current.json"
        },
        {
          "status": " M",
          "path": "ai-harness-local/progress/current.md"
        },
        {
          "status": " M",
          "path": "ai-harness/AGENTS.md"
        },
        {
          "status": " M",
          "path": "ai-harness/CHANGELOG.md"
        },
        {
          "status": " M",
          "path": "ai-harness/README.md"
        },
        {
          "status": " M",
          "path": "ai-harness/VERSION"
        },
        {
          "status": " M",
          "path": "ai-harness/config/project.json"
        },
        {
          "status": " M",
          "path": "ai-harness/docs/backlog-contract.md"
        },
        {
          "status": " M",
          "path": "ai-harness/docs/workflow.md"
        },
        {
          "status": " M",
          "path": "ai-harness/harness/control.mjs"
        },
        {
          "status": " M",
          "path": "ai-harness/harness/lifecycle.mjs"
        },
        {
          "status": " M",
          "path": "ai-harness/harness/tests/control.test.mjs"
        },
        {
          "status": " M",
          "path": "ai-harness/harness/tests/lifecycle.test.mjs"
        },
        {
          "status": " M",
          "path": "docs/CANONICAL_INDEX.md"
        },
        {
          "status": " M",
          "path": "docs/EXECUTION_BACKLOG_2026-09-08.md"
        },
        {
          "status": " M",
          "path": "docs/audit/HARNESS_CAPABILITY_GAP_2026-09-08.md"
        },
        {
          "status": " M",
          "path": "package.json"
        },
        {
          "status": " M",
          "path": "planning/backlog.json"
        },
        {
          "status": " M",
          "path": "planning/fragments/platform.json"
        },
        {
          "status": "??",
          "path": "ai-harness/docs/intake.md"
        },
        {
          "status": "??",
          "path": "ai-harness/harness/backlog-governance.mjs"
        },
        {
          "status": "??",
          "path": "ai-harness/harness/intake.mjs"
        },
        {
          "status": "??",